subject,label,comment,type,subClassOf
http://www4.wiwiss.fu-berlin.de/bizer/bsbm/v01/instances/ProductType61,"supersexes","messman cinquains enfoldings tutoresses folktale zonetimes removed mein boxful allergen lindanes causerie lieut yummies prickiest cording disinterested scribers sapidity yours aesopian debauchees cumquat cloaked sandbags intellectually duplicates umbeled anomalies hacked",http://www4.wiwiss.fu-berlin.de/bizer/bsbm/v01/vocabulary/ProductType,http://www4.wiwiss.fu-berlin.de/bizer/bsbm/v01/instances/ProductType10
http://www4.wiwiss.fu-berlin.de/bizer/bsbm/v01/instances/ProductType129,"kaftans tangram","illness vaultier quads departmental cupped limpers antiinsurrectionists outfacing kwhr dissimulated inciters sportily circumstantiation scrimping bristles lines piezochemistry pyloruses tempting headpiece overwound temporizer barbarianism toeplates unforgiven celebration trekkers burweed bravest teacake pursuance inhering ninnyish pampean toastmistresses overbids implausibly proctoscopically unfrock untruthful stomper surcharging strictly morganatic elicitors quadruplications spenders kickstands",http://www4.wiwiss.fu-berlin.de/bizer/bsbm/v01/vocabulary/ProductType,http://www4.wiwiss.fu-berlin.de/bizer/bsbm/v01/instances/ProductType44
http://www4.wiwiss.fu-berlin.de/bizer/bsbm/v01/instances/ProductType62,"personas antechambers","boomerangs jockeys muumuu workup blah rhododendrons executors eyewitnesses meas hidebound sonants offence dashes reposed reluctancy reshuffles subaverage eternize congratulations encephalitic wooshing potentiates cerecloths leftism plinths nervously pinholes articular brilliancy ancien promulgators",http://www4.wiwiss.fu-berlin.de/bizer/bsbm/v01/vocabulary/ProductType,http://www4.wiwiss.fu-berlin.de/bizer/bsbm/v01/instances/ProductType11
http://www4.wiwiss.fu-berlin.de/bizer/bsbm/v01/instances/ProductType63,"henpecked designs undersigned","nocturnes facially esplanades reconversions irruptions shamefully eclecticism middlebrowism commitments crabber workingwomen entwine outrace sweated caravaning uncritical winkles dippy pestiferous extraterrestrially criminology genres wrongers",http://www4.wiwiss.fu-berlin.de/bizer/bsbm/v01/vocabulary/ProductType,http://www4.wiwiss.fu-berlin.de/bizer/bsbm/v01/instances/ProductType11
http://www4.wiwiss.fu-berlin.de/bizer/bsbm/v01/instances/ProductType64,"handpicks burs skullduggeries","warmongers kart nonperishable restfully remailed erose bries reattempts anoints placket nutcrackers braggadocio darkener adagial transients unpaying blintzes mobsters dinking pericardial sequentially uncivilized potences attenuated cuish craftiness romances",http://www4.wiwiss.fu-berlin.de/bizer/bsbm/v01/vocabulary/ProductType,http://www4.wiwiss.fu-berlin.de/bizer/bsbm/v01/instances/ProductType12
http://www4.wiwiss.fu-berlin.de/bizer/bsbm/v01/instances/ProductType65,"deluged divvy","sideslipping barhop reprintings smells pilothouse malefactresses upholstered valutas wrings timpanists wardrobes adoze disintegrated atrophied houseboy ineligibly injustices featherless transubstantiation ruffles cottoned recounted pelleting subrule respectable floorings aerobatics furrowers redid goofed updates aspects mayday permeably revs vernaculars croakier ramparted bethels pyrenees deactivated syne erasures technics nonirritant",http://www4.wiwiss.fu-berlin.de/bizer/bsbm/v01/vocabulary/ProductType,http://www4.wiwiss.fu-berlin.de/bizer/bsbm/v01/instances/ProductType12
http://www4.wiwiss.fu-berlin.de/bizer/bsbm/v01/instances/ProductType66,"ethnicity","ricochets unproductively searer dropsied fey gimcrack flamines shunpiked samplings moroccos titrant dogger infundibula voided gangers encompassed accounter globetrotting lasing supplicated babkas pigments warthogs",http://www4.wiwiss.fu-berlin.de/bizer/bsbm/v01/vocabulary/ProductType,http://www4.wiwiss.fu-berlin.de/bizer/bsbm/v01/instances/ProductType13
http://www4.wiwiss.fu-berlin.de/bizer/bsbm/v01/instances/ProductType67,"antiparticles","abeyancy polygonally disgustedly middies epistolary caromed bleeps funerals decolonizing nervy klutzes spatular ouzels stemware drillings gunstock fructoses razors imprecisely overinvested vaquero indirectly uncharitable",http://www4.wiwiss.fu-berlin.de/bizer/bsbm/v01/vocabulary/ProductType,http://www4.wiwiss.fu-berlin.de/bizer/bsbm/v01/instances/ProductType13
http://www4.wiwiss.fu-berlin.de/bizer/bsbm/v01/instances/ProductType68,"dangled","gorgeousness appendages teethings jingoist potbellies qui sigmoids lobotomies bestrewn forsakers lowing equitant foods designment vibrance atheists suffixion gamy tundras shortening samovars soapbark bulled electropositive reworking realigns ultrastructural repowering mammalians hedgier liberationist bronzing",http://www4.wiwiss.fu-berlin.de/bizer/bsbm/v01/vocabulary/ProductType,http://www4.wiwiss.fu-berlin.de/bizer/bsbm/v01/instances/ProductType14
http://www4.wiwiss.fu-berlin.de/bizer/bsbm/v01/instances/ProductType69,"crowner uncharacteristic enquirer","accumulated topologically truistic sceptered glamorization reverers golfed saintly yetis imponderability electrochemistry pyrotechnical pronouncing disaffiliation avoided ortho scraggier trapezoids singling indianians reflexiveness conchoid nakedness tarn spacewalk abscises remelts evaluations debating surrealistically biomechanics cherishing noisier terrines quincunx roistering contours tweedles sinicize hon poppets stockading nurserymen bidders weirder pederasty impassability incitants",http://www4.wiwiss.fu-berlin.de/bizer/bsbm/v01/vocabulary/ProductType,http://www4.wiwiss.fu-berlin.de/bizer/bsbm/v01/instances/ProductType14
http://www4.wiwiss.fu-berlin.de/bizer/bsbm/v01/instances/ProductType130,"upsilons aureolas","barrenness ascenders perforation magistery denominating monogamists serials elands trilled illegitimation unhesitatingly aweless notarial vistas nags rathskellers grasped bowleg prelatic prevues crumps cyborg peninsular reconfirmations mallets intellects kebabs rebound crimes wheezers editorially verges larvas bakeries lazarettos storeyed reascent overassured transliteration unmuzzle attorneys paunchier overinclines mermen challises",http://www4.wiwiss.fu-berlin.de/bizer/bsbm/v01/vocabulary/ProductType,http://www4.wiwiss.fu-berlin.de/bizer/bsbm/v01/instances/ProductType45
http://www4.wiwiss.fu-berlin.de/bizer/bsbm/v01/instances/ProductType131,"plaice","trucklers imitation pavlovian whitewalls snippets faller ombre lockless cynosure tricuspid trustwoman redemonstrated parceling trashed tollways hawses priced legalistic inhospitality abandons straightedge debriefings cerebration paddocks bravely marihuana safflower gesticulation blandest glaringly",http://www4.wiwiss.fu-berlin.de/bizer/bsbm/v01/vocabulary/ProductType,http://www4.wiwiss.fu-berlin.de/bizer/bsbm/v01/instances/ProductType45
http://www4.wiwiss.fu-berlin.de/bizer/bsbm/v01/instances/ProductType132,"perambulate","turnabouts teaspoonsful stretchable electees weensiest mannerly abscam abstinence hypodermically concealed gweducks parodies lairds pipeful conducers planters kakas neptunian cufflinks dandyish openheartedness kasha increased foozlers",http://www4.wiwiss.fu-berlin.de/bizer/bsbm/v01/vocabulary/ProductType,http://www4.wiwiss.fu-berlin.de/bizer/bsbm/v01/instances/ProductType46
http://www4.wiwiss.fu-berlin.de/bizer/bsbm/v01/instances/ProductType133,"yukking quaintness imbricate","bazooka philosophized fructifying inviters demonstrative helixes defiles apotheoses relentlessly mountaintops resituate slimmest exotics chorused hypnotize acidhead zincky supporters unenterprising mangler embezzling overeducating preventives lichee platypuses imagination speared cloudbursts constellation ensnarements depreciators prettification golliwogs undesired consists waggeries stiffeners reactive quells typographically allays",http://www4.wiwiss.fu-berlin.de/bizer/bsbm/v01/vocabulary/ProductType,http://www4.wiwiss.fu-berlin.de/bizer/bsbm/v01/instances/ProductType46
http://www4.wiwiss.fu-berlin.de/bizer/bsbm/v01/instances/ProductType134,"vapourers chainmen","unsought miscounted nullifications elflock contortionists capablest lucubrate ablated entrenches gaslit answerability churl aortas rackers novices hamburgers nonperishable uprooters vitally contentiousness indiscrete tramming whiteners firebombed transmits wrathier plebes cabbalahs tortured deflation",http://www4.wiwiss.fu-berlin.de/bizer/bsbm/v01/vocabulary/ProductType,http://www4.wiwiss.fu-berlin.de/bizer/bsbm/v01/instances/ProductType47
http://www4.wiwiss.fu-berlin.de/bizer/bsbm/v01/instances/ProductType135,"pieing","flukes darneder dyslectic ritzier singing momism converses poliomyelitic shivas marrowed ditchless restructured maned selfness discerners abundances jeerers unconvincingly nonsuccessiveness adventuress antiquing fluidly nonaggression preexamining docilities spiniest jazziness arables intensifications weirder emasculation taphole raffling bespoken enneads goldener ameer memorably bamboozled thiabendazole pining genially",http://www4.wiwiss.fu-berlin.de/bizer/bsbm/v01/vocabulary/ProductType,http://www4.wiwiss.fu-berlin.de/bizer/bsbm/v01/instances/ProductType47
http://www4.wiwiss.fu-berlin.de/bizer/bsbm/v01/instances/ProductType136,"mesonic","maypole handcrafting wintergreens athletically didies bolshevists mourning enslaved micromillimeter cerebri emulatively galoshed soughed relighting primero rebuked waterlogging apartmental consequentially eely smokeless crumples whiners nisei noncivilized nonexistence manitou strippers topographers anticipation motorships mitigatory packers stabilize freshens zombis invisibility reoccurred submicroscopic latchkey visaed lesbians",http://www4.wiwiss.fu-berlin.de/bizer/bsbm/v01/vocabulary/ProductType,http://www4.wiwiss.fu-berlin.de/bizer/bsbm/v01/instances/ProductType48
http://www4.wiwiss.fu-berlin.de/bizer/bsbm/v01/instances/ProductType137,"aphrodisia","resole wrings superposition campaigns gifting lins copal reawoke gaffes boosting deductibility balsamic entices discolored pinchpenny chasmed hatefulness impiously scramming fiberizes swarthiness renege misrepresented petiole holist reconsolidations mukluks hypocritically busiest gulpers cherishes pleasureful phonily",http://www4.wiwiss.fu-berlin.de/bizer/bsbm/v01/vocabulary/ProductType,http://www4.wiwiss.fu-berlin.de/bizer/bsbm/v01/instances/ProductType48
http://www4.wiwiss.fu-berlin.de/bizer/bsbm/v01/instances/ProductType70,"trillium thousandths testers","glimpsed dishonoring railroaders quarreling privacies homemaking grinners scag foredoing inhalants dekagram fortis brunched unsparingness rosarian oxygenated sartorially misshaping probationary incompressable braziers toxicoid mollified truculence bannister sluts hogtieing savoured flops unified cowering gluttonously",http://www4.wiwiss.fu-berlin.de/bizer/bsbm/v01/vocabulary/ProductType,http://www4.wiwiss.fu-berlin.de/bizer/bsbm/v01/instances/ProductType15
http://www4.wiwiss.fu-berlin.de/bizer/bsbm/v01/instances/ProductType138,"climbers rappelling frequency","meaningless sotted cottoned empaling larking setlines cubicity ennead guaranis quietisms preconceive maligners fluxed swamps shuteye nonsensitive bedouin bailouts reaccustomed dramamine reloader trampoliners workaholism harries gauziness singing impregnations loggias bicyclists",http://www4.wiwiss.fu-berlin.de/bizer/bsbm/v01/vocabulary/ProductType,http://www4.wiwiss.fu-berlin.de/bizer/bsbm/v01/instances/ProductType49
http://www4.wiwiss.fu-berlin.de/bizer/bsbm/v01/instances/ProductType71,"nonunionist roan lawnmower","antifreezes pacemaker quotations cutthroats severance disinheriting effloresced halftones snuffy forelegs anticommunism reembarks hypothyroids standings kindredship whippiest assortments snuffier bonfires inadmissable charters penetrator hospitableness gasified nudity uncoil ghanaians frailties restore disappointment mints minder ecologist ecstatically sufferers portioner flagella merrier",http://www4.wiwiss.fu-berlin.de/bizer/bsbm/v01/vocabulary/ProductType,http://www4.wiwiss.fu-berlin.de/bizer/bsbm/v01/instances/ProductType15
http://www4.wiwiss.fu-berlin.de/bizer/bsbm/v01/instances/ProductType139,"toggles","regurgitated presbyope breakfasting pollutants reinstating encephalography robotization advisement hereditariness unsung giggling eczematous demeans uncashed newsiest rantingly bulgarians treasonably inchoate tenpins squabbling sailcloth boffins oscars stapedes teacupful paleocene mothproof malarious sixteenths inwards plausibility rooted bdrm sarod forecloses introducible cocain equivoke aromatize reaccompanies election unpinned haled constructed",http://www4.wiwiss.fu-berlin.de/bizer/bsbm/v01/vocabulary/ProductType,http://www4.wiwiss.fu-berlin.de/bizer/bsbm/v01/instances/ProductType49
http://www4.wiwiss.fu-berlin.de/bizer/bsbm/v01/instances/ProductType72,"huskies pacemakers","upcurve condos bunds cuckolded undertrained inning hobbled cubebs incompletely garbling provincially malignancy aced despisers sucked presifted objurgations immunized ratsbane missions",http://www4.wiwiss.fu-berlin.de/bizer/bsbm/v01/vocabulary/ProductType,http://www4.wiwiss.fu-berlin.de/bizer/bsbm/v01/instances/ProductType16
http://www4.wiwiss.fu-berlin.de/bizer/bsbm/v01/instances/ProductType73,"rainwater phylacteries","smoked shoes howdie inconsolably remolds triadics amnesias ascendance alluding stretched buffoonish subcompact crutched brittleness subsides feaze outbalance castings beechier soapers vaunted ducal brachium cymbals delegalizing trichlorethylenes metallurgists revarnishes ampulla confidences nickels bedraggled spurring overcapitalize gyrates cabochons teargases xxii albumen mellowest workweeks cartloads cedarwood staterooms uncrosses",http://www4.wiwiss.fu-berlin.de/bizer/bsbm/v01/vocabulary/ProductType,http://www4.wiwiss.fu-berlin.de/bizer/bsbm/v01/instances/ProductType16
http://www4.wiwiss.fu-berlin.de/bizer/bsbm/v01/instances/ProductType74,"opened predatoriness synchronizer","reasonless vaultings kooky reposition acidification languishers skidded bolted surmounts unaffiliated annexational thrilled froggiest mismatched neckwears discrepantly gauchos caoutchouc southerner perkily genres bednights authenticity rains tighter cooperators appaloosa reshuffled hosier boudoir pumped",http://www4.wiwiss.fu-berlin.de/bizer/bsbm/v01/vocabulary/ProductType,http://www4.wiwiss.fu-berlin.de/bizer/bsbm/v01/instances/ProductType17
http://www4.wiwiss.fu-berlin.de/bizer/bsbm/v01/instances/ProductType75,"broguery","remonetization bunting ultimatums otiosely tenderize bioenvironmentaly virilities outrun gustation perishably mulier degermed motorizes positiveness slimming bottleful icelander falsettos extemporized unscholarly distensibilities manometric preblesses chasmed ensnarling yippie cogence bulbed alchemist autointoxication strugglers slangiest dendrites",http://www4.wiwiss.fu-berlin.de/bizer/bsbm/v01/vocabulary/ProductType,http://www4.wiwiss.fu-berlin.de/bizer/bsbm/v01/instances/ProductType17
http://www4.wiwiss.fu-berlin.de/bizer/bsbm/v01/instances/ProductType76,"periodontics personalization","checkmated creasing obstructors hamstringing outgo buzzards subtending demits sputters cocomats inconclusiveness colonic vendibility scrutinizers photoengravers browses ultrasonics assented bigamy vouches overexpectant aligning choleric equivocalness netty ironworks rockers cardiographies",http://www4.wiwiss.fu-berlin.de/bizer/bsbm/v01/vocabulary/ProductType,http://www4.wiwiss.fu-berlin.de/bizer/bsbm/v01/instances/ProductType18
http://www4.wiwiss.fu-berlin.de/bizer/bsbm/v01/instances/ProductType77,"flinders meeker fumes","kebab gerontologist befuddlement ripplers repopulates shingles clodpate expiating monosodium sportscaster rustily assailing egomaniac laundrywomen cameleers contemplative recumbencies pigsties tramcar excitor airlifting veiner rewin imprints infringes shrinker footnotes leafage chariness coquetting reverified ob apennines snoot basify cranched",http://www4.wiwiss.fu-berlin.de/bizer/bsbm/v01/vocabulary/ProductType,http://www4.wiwiss.fu-berlin.de/bizer/bsbm/v01/instances/ProductType18
http://www4.wiwiss.fu-berlin.de/bizer/bsbm/v01/instances/ProductType78,"japanizes","tetany peppercorns rumormonger unarrested bedgowns dippier monomanias transcendentally cremator spathic megabits strays swankier parolable nudges airiness neutralize nutrias tarrying phlegm vaultings tootling kathartic geopolitics approvals reexpressed kindlers naturalized",http://www4.wiwiss.fu-berlin.de/bizer/bsbm/v01/vocabulary/ProductType,http://www4.wiwiss.fu-berlin.de/bizer/bsbm/v01/instances/ProductType19
http://www4.wiwiss.fu-berlin.de/bizer/bsbm/v01/instances/ProductType79,"matzo fishways","decomposing apronlike solarisms blighting aridity skittles redry sergeancies prepared saps outcropped unsubdued urgingly wierd cogitator backbends immovably seceders recumbencies dehumidifying demeans casehardening serialization foreplay reunifications diminishes fagoting enlister lightest expands radioscopical solvable windbreaks sultans schmoozed smashing tribades dbl errs sniggeringly bourgeoned hellcats recreative unerringly embalmer synovias chorussed",http://www4.wiwiss.fu-berlin.de/bizer/bsbm/v01/vocabulary/ProductType,http://www4.wiwiss.fu-berlin.de/bizer/bsbm/v01/instances/ProductType19
http://www4.wiwiss.fu-berlin.de/bizer/bsbm/v01/instances/ProductType140,"containments","mistiest reestablishing hoofbeat poltroon treasons spavined veilings chemism circuity hemlocks yeshivah overwilling egalitarians bullies toper observably saclike octopuses opted stipulator hoosegows outputted confuter pitiably rhetors fledges jocosely parasiticide duodenum hibernator placing prochurch belows collaborative whipworms sanctifier slummiest diaeresis baubles subtleness nebulise",http://www4.wiwiss.fu-berlin.de/bizer/bsbm/v01/vocabulary/ProductType,http://www4.wiwiss.fu-berlin.de/bizer/bsbm/v01/instances/ProductType50
http://www4.wiwiss.fu-berlin.de/bizer/bsbm/v01/instances/ProductType141,"refastens dentins agates","enjoyer odiousness ascertainment porks mutineered chuckler paganisms bicarb hadjee sonatinas passions profuseness trampled uncloaked dentures synchro niggards corporately sawboneses vicinage dams simplifier nonrepresentational",http://www4.wiwiss.fu-berlin.de/bizer/bsbm/v01/vocabulary/ProductType,http://www4.wiwiss.fu-berlin.de/bizer/bsbm/v01/instances/ProductType50
http://www4.wiwiss.fu-berlin.de/bizer/bsbm/v01/instances/ProductType142,"cleansers accelerative stepparents","expediently bedcovers dakotan halavahs remora nonrecurrent unsent assuror petcocks sequenced gusseted unartistic mayoresses blatter scandaling bristly kindler flirtingly redeye screwer bubbletops littery improbability dunghill assonances punctiliousness bushman grainer extras evener reequipped appealingly cursers impassioned bunkhouses satirizes hyperbolas offensively bashers achenes",http://www4.wiwiss.fu-berlin.de/bizer/bsbm/v01/vocabulary/ProductType,http://www4.wiwiss.fu-berlin.de/bizer/bsbm/v01/instances/ProductType51
http://www4.wiwiss.fu-berlin.de/bizer/bsbm/v01/instances/ProductType143,"submental","fusel imaginal debs rushing housewarming desensitizing bearably dimmers civvies forestays tastelessly incorporations grounds drawers gibbetted melts commodores hundredths nebs repave killjoys weariest cannonism henrys featheredge replenisher magniloquence retypes gulfy bobtailed graduators wicked veluring ginning paced autoimmunization occlusal spright hooraying intonating wildwood",http://www4.wiwiss.fu-berlin.de/bizer/bsbm/v01/vocabulary/ProductType,http://www4.wiwiss.fu-berlin.de/bizer/bsbm/v01/instances/ProductType51
http://www4.wiwiss.fu-berlin.de/bizer/bsbm/v01/instances/ProductType144,"unduly betted","broadness pharyngectomies outpatient monsignors uncorroborated knells catalos meanderer dwindling retransferring employability hellcats ruble commingling shoestrings recompensatory selectors hoopster bahamians truest unascertainable taiwanese skullduggeries canonizes unspeakable tautologies nondiscriminatory dispatchers construction inhabitress vasodilatation devilments fugally malfunctions manginess shoving",http://www4.wiwiss.fu-berlin.de/bizer/bsbm/v01/vocabulary/ProductType,http://www4.wiwiss.fu-berlin.de/bizer/bsbm/v01/instances/ProductType52
http://www4.wiwiss.fu-berlin.de/bizer/bsbm/v01/instances/ProductType145,"winterers","awless guars muddied tenets gunwale baalism plumps sidlers manipulated wastable bibberies outfielded inspectorial tolerably quasars ataxia battlements reverifying pastimes mukluk writers coted revisiting invoker counterrevolutions stellas thoracic empathizing pomegranates entangling scouter femininity antichrist untruthfulness pucks casehardening botcher headbands moory bakes ourangs awkwardest buzzers medicks impenetrably inheritress communicatively notation",http://www4.wiwiss.fu-berlin.de/bizer/bsbm/v01/vocabulary/ProductType,http://www4.wiwiss.fu-berlin.de/bizer/bsbm/v01/instances/ProductType52
http://www4.wiwiss.fu-berlin.de/bizer/bsbm/v01/instances/ProductType146,"discourages strutted warbles","caramelizes legalized storefronts ungallantly tamer suspended extorting enchant lilliputians trappings germanized sexagenarians nutritiousness jargonize lunas mischief pluperfects ructions subverts copepods syncopes planetoids valorized freightyard fatherhood quackish orisons underfinances civilized centuple perverted psychedelically tuckets petitioner ossea delegacies aquiline dared percussor tariffing kirtled",http://www4.wiwiss.fu-berlin.de/bizer/bsbm/v01/vocabulary/ProductType,http://www4.wiwiss.fu-berlin.de/bizer/bsbm/v01/instances/ProductType53
http://www4.wiwiss.fu-berlin.de/bizer/bsbm/v01/instances/ProductType147,"missal","bonos baptisteries terrines worshipping hatchways partitions factorage nonbreakable surplices lave standings velds samariums bleacher systematize chaconnes tilers eyrie gladiatorial appliqued shedable laserdisks mfd seducible buns freethinking strayers degauss airwomen glycemia vagrancy floodwater brachydactylous",http://www4.wiwiss.fu-berlin.de/bizer/bsbm/v01/vocabulary/ProductType,http://www4.wiwiss.fu-berlin.de/bizer/bsbm/v01/instances/ProductType53
http://www4.wiwiss.fu-berlin.de/bizer/bsbm/v01/instances/ProductType80,"dismounting soffits","czechoslovak flattener spectroscopical successes charbroil hermetically rainmaking trafficable skeletons sipper sweeter avocational pompoms gardener thready supervises forgetfully topflight tribunals veering soldierly internodal disillusion resizing primariness dodos dressmaking victualled mashie aggies iniquitously meningism disrepute buttonhook gladiate tropins junkier bringing fertilizers makeups wildwood supererogation",http://www4.wiwiss.fu-berlin.de/bizer/bsbm/v01/vocabulary/ProductType,http://www4.wiwiss.fu-berlin.de/bizer/bsbm/v01/instances/ProductType20
http://www4.wiwiss.fu-berlin.de/bizer/bsbm/v01/instances/ProductType148,"ophthalmoscopes awed","candies resummoning floatiest underexpose smidgen extremity uprootals panicled ormolus octangle persisters sawing pulses shellfish snowfalls reverer trove tenting genocide imprinters nonsecret habitude interdictor deedless serenaded abolitionary carboyed obstetrically scraggier canard ratification viticulture privileges enplaned montaged toothiest recompounded sappiness overspends discovering buttonholer bezils sociologic extortionists geegaw ontologies powders bookshops",http://www4.wiwiss.fu-berlin.de/bizer/bsbm/v01/vocabulary/ProductType,http://www4.wiwiss.fu-berlin.de/bizer/bsbm/v01/instances/ProductType54
http://www4.wiwiss.fu-berlin.de/bizer/bsbm/v01/instances/ProductType81,"imputations smiters exteriorly","sensed exaggerative leftwing kelped trembler recessions limbing roofings overfanciful turbines subscriptions creoles succour tenty cameoing rehearser shamois relearn grogs rescheduled interpolating guesstimate unbeliever prolixly swishers reformer reinvestigating underproduced interloping clarinetist unopened divines quagga dashiki caressers cantered pinners cubages acidosis reattempt casts confuted",http://www4.wiwiss.fu-berlin.de/bizer/bsbm/v01/vocabulary/ProductType,http://www4.wiwiss.fu-berlin.de/bizer/bsbm/v01/instances/ProductType20
http://www4.wiwiss.fu-berlin.de/bizer/bsbm/v01/instances/ProductType149,"argentum","loins hypoderm adulteresses elicitors nitrated timeserver clifts tasked ochery privities spreadsheets conditionality physics boarders blitheness yowling tressiest foolery liabilities bordels poodles lyes cantankerously lambed ripened tomtit flypapers beholders plumpness orrery regicide libbers bacchanal costumiers sinner humanest algerians reappearance reminiscence comped massless durn",http://www4.wiwiss.fu-berlin.de/bizer/bsbm/v01/vocabulary/ProductType,http://www4.wiwiss.fu-berlin.de/bizer/bsbm/v01/instances/ProductType54
http://www4.wiwiss.fu-berlin.de/bizer/bsbm/v01/instances/ProductType82,"curmudgeons diddlers","dissection scummiest injectant pelves punctilious statutableness videos coinsurer scalawags deadeye semierect champagnes ridicules nocturn untethers cutlery remonstrance manometric jacketed warningly discomposing filtrating alloted unverifiably deleting citicorp",http://www4.wiwiss.fu-berlin.de/bizer/bsbm/v01/vocabulary/ProductType,http://www4.wiwiss.fu-berlin.de/bizer/bsbm/v01/instances/ProductType21
