subject,label,comment,type,subClassOf
http://www4.wiwiss.fu-berlin.de/bizer/bsbm/v01/instances/ProductType83,"scorched deprecatingly gooder","pertinacity sunshines tolerative ravishments attraction provocatively remits pieta reawakened ostensive pauperization subrules denuding hedges gangplow glaciology oratories carnify broodiest celebre relenting boxer hotdogging mouthwash unexampled multilayer ceder limeades unmended diluted lays anneals bludgeoning mediumistic vaster goebbels sponsorial digitalized ballyhooing arsenites esculents cupronickel hysterectomies thunderhead overscrupulous aortal faiths nits",http://www4.wiwiss.fu-berlin.de/bizer/bsbm/v01/vocabulary/ProductType,http://www4.wiwiss.fu-berlin.de/bizer/bsbm/v01/instances/ProductType21
http://www4.wiwiss.fu-berlin.de/bizer/bsbm/v01/instances/ProductType84,"perpendiculars","batistes chewer asks beholden tidies trochaics disinfects genet quahaugs nondrinker escallop tremolo immigrated brutally backstitching clamorously uncongenial blustered lechered antidotal reimburses waffling embroiderer prepublication ephedrin jauntiness polarization divisions equivalences transgressors insaner gumtree feared obstructer",http://www4.wiwiss.fu-berlin.de/bizer/bsbm/v01/vocabulary/ProductType,http://www4.wiwiss.fu-berlin.de/bizer/bsbm/v01/instances/ProductType22
http://www4.wiwiss.fu-berlin.de/bizer/bsbm/v01/instances/ProductType85,"boatbills multitudes","parachuted coarsely hyposensitize unpossessive stateside coiffes embarrassing considering sharpens farsightedly tartrated bentonite joggles eyeholes contextually bruited osmotically highhandedly jays ordnances casts bested blandishment vilifiers recleaning spunky drawlers warping labeled honied clotures tillage bearably chickpea inflationism meniscectomy dishpan prevailers tosser rf maledictive constants elusion ingression seismometric stipulated forbearer cadaverously hindermost nutrimental",http://www4.wiwiss.fu-berlin.de/bizer/bsbm/v01/vocabulary/ProductType,http://www4.wiwiss.fu-berlin.de/bizer/bsbm/v01/instances/ProductType22
http://www4.wiwiss.fu-berlin.de/bizer/bsbm/v01/instances/ProductType86,"unaccessible biter catenating","reembarkation fortuneteller corporations stealer chalkier refinances hairwork progressed squattiest masse defeminize pectorals inculpability glossing uneducable documented sparkier thumbscrews peckier frothily terrane homespuns unpasteurized undercoating revenant interrupting believeth torii phonemes movability",http://www4.wiwiss.fu-berlin.de/bizer/bsbm/v01/vocabulary/ProductType,http://www4.wiwiss.fu-berlin.de/bizer/bsbm/v01/instances/ProductType23
http://www4.wiwiss.fu-berlin.de/bizer/bsbm/v01/instances/ProductType87,"throngs ataxy outstares","yoking desensitizing dieters interbanking guardianship unstructured endocrinologic legitimateness cotangents deceiving peripherally prinking confutation steeped identifiable secretariats climacterics quittors psychokinesis hoggishly unpracticable infields gaveled appetizers sphygmographies unadjustable achiever rankest flexes bedfellows vendees kneaded",http://www4.wiwiss.fu-berlin.de/bizer/bsbm/v01/vocabulary/ProductType,http://www4.wiwiss.fu-berlin.de/bizer/bsbm/v01/instances/ProductType23
http://www4.wiwiss.fu-berlin.de/bizer/bsbm/v01/instances/ProductType88,"ascriptions talkable","asylums remeasurement eggplants rearousal shirtiest tatters gnawingly extorting dost tannates flunking unplanned shacking sorel reportedly cowing goodwills cavalierness sanding porphyries",http://www4.wiwiss.fu-berlin.de/bizer/bsbm/v01/vocabulary/ProductType,http://www4.wiwiss.fu-berlin.de/bizer/bsbm/v01/instances/ProductType24
http://www4.wiwiss.fu-berlin.de/bizer/bsbm/v01/instances/ProductType89,"conscienceless","cst turtler matzos beltlines pantries emigrating opacities writing brands overman audiologists teratologist trustfulness muddleheaded pawing fishpole whoosis silverfish cankers horologies exuberantly confederative sander parve fumet groundwave enrichments",http://www4.wiwiss.fu-berlin.de/bizer/bsbm/v01/vocabulary/ProductType,http://www4.wiwiss.fu-berlin.de/bizer/bsbm/v01/instances/ProductType24
http://www4.wiwiss.fu-berlin.de/bizer/bsbm/v01/instances/ProductType150,"mobcaps antepast","rastafarian sassily bowknots durns ekistics copped cooperatively climatotherapies darkrooms provocations dogwatch schussing undone acclaimer clonking presifted forgives scholarships cesarian siameses propitiatory autoclaves busyness gladiate areoles shedder selvaged cerebric scatted outworkers debouched knave perplexed paladin",http://www4.wiwiss.fu-berlin.de/bizer/bsbm/v01/vocabulary/ProductType,http://www4.wiwiss.fu-berlin.de/bizer/bsbm/v01/instances/ProductType55
http://www4.wiwiss.fu-berlin.de/bizer/bsbm/v01/instances/ProductType151,"heavily apocalyptical salvable","petters barbarities sogginess fangless shoptalk wakening astrolabe mistrusting overbuy telephotographic mikveh lockjaw gravitons durns earthiness psychotropic pranksters overtrained recapitulate sublease introducers pastilles eddying nonconforming scorify frankly cantors griming prettier accruals nonselective suavest",http://www4.wiwiss.fu-berlin.de/bizer/bsbm/v01/vocabulary/ProductType,http://www4.wiwiss.fu-berlin.de/bizer/bsbm/v01/instances/ProductType55
http://www4.wiwiss.fu-berlin.de/bizer/bsbm/v01/instances/ProductType90,"electromagnetical resifted","crueler cured impalement needers poker crackdown overattached kantian honeycombs moneymakers mens reclassified gainsayer maenads conjectures garniture pronghorns grantors inceptive fretful puttee generational drowses cliquiest descry tonneaux blubbery cybernation",http://www4.wiwiss.fu-berlin.de/bizer/bsbm/v01/vocabulary/ProductType,http://www4.wiwiss.fu-berlin.de/bizer/bsbm/v01/instances/ProductType25
http://www4.wiwiss.fu-berlin.de/bizer/bsbm/v01/instances/ProductType91,"boulimia ousels","gallnuts particularly ensnarled premising festivals unrests lingers thunderheads kb overcompensating relicenses codger reaccredit rehanged reabandons emulating inflators destitution middies chapping",http://www4.wiwiss.fu-berlin.de/bizer/bsbm/v01/vocabulary/ProductType,http://www4.wiwiss.fu-berlin.de/bizer/bsbm/v01/instances/ProductType25
http://www4.wiwiss.fu-berlin.de/bizer/bsbm/v01/instances/ProductType92,"sneering smartens motivated","votaries analects cloverleaf vinic spurting brevi conks assuredly tarps cords outstandingly cohesions nonviolent humanization transmissive parring napes muslims jounced ethicalness fumbler cocomat tusked restamp reactance couped forebye antipacifists reavowing restamping copyholders hagride exclaimer",http://www4.wiwiss.fu-berlin.de/bizer/bsbm/v01/vocabulary/ProductType,http://www4.wiwiss.fu-berlin.de/bizer/bsbm/v01/instances/ProductType26
http://www4.wiwiss.fu-berlin.de/bizer/bsbm/v01/instances/ProductType93,"avulsions goldenly","rollovers annularity vermiculites seepages phycomycete winner julienne communicated cryptograph relapse inveteracy barometrograph desponded scepters microns condors wastier recoveries polyclinic wallahs polemist croaking abandoned lauders misdemeanor underlies scourges flatfooted breasts cranked piccalillis masterminded playfellows psalters varietally intoxicatedly squatness sugarier legalness gracile recount pangs palefaces lacerations tensiometer judgelike lutist tongueless reinsman asterisks",http://www4.wiwiss.fu-berlin.de/bizer/bsbm/v01/vocabulary/ProductType,http://www4.wiwiss.fu-berlin.de/bizer/bsbm/v01/instances/ProductType26
http://www4.wiwiss.fu-berlin.de/bizer/bsbm/v01/instances/ProductType94,"darkliest isolator","engagement transoms lenience gunmetals neutrals fugging caffeins arbor actinides hellgrammites succulents trollies sawed vouches instructed restraightened buttresses swagger darwinians deselects budgie emetically miscued miaou premises hepatize columnist understandingly sleeker lightering grandee contours despatcher coalholes technologist",http://www4.wiwiss.fu-berlin.de/bizer/bsbm/v01/vocabulary/ProductType,http://www4.wiwiss.fu-berlin.de/bizer/bsbm/v01/instances/ProductType27
http://www4.wiwiss.fu-berlin.de/bizer/bsbm/v01/instances/ProductType95,"stoup","bast donative outfaces endear workhouse dom motorists frizzy lallygagged salinity broaching equivocates recapitulates collocated divinize genic maladministering envied nappy incentives salvages cloverleaf plainsmen librettos inflamers neutrons accelerates gormands elidible tutorship registership fieldpieces uncloak mktg culler preexisting pantomiming granaries yolked",http://www4.wiwiss.fu-berlin.de/bizer/bsbm/v01/vocabulary/ProductType,http://www4.wiwiss.fu-berlin.de/bizer/bsbm/v01/instances/ProductType27
http://www4.wiwiss.fu-berlin.de/bizer/bsbm/v01/instances/ProductType96,"cluttered horded voter","cynically raincoats pulpits pods hankie lengthily guiltily flossier defamed peels underemphasized whited regulations disused drainpipe realignment generative droopiest reship elucidation clunkers renouncements browns workmaster panaches disassociate stretched hopes subnormally xanthippe hemistich inquired stalled",http://www4.wiwiss.fu-berlin.de/bizer/bsbm/v01/vocabulary/ProductType,http://www4.wiwiss.fu-berlin.de/bizer/bsbm/v01/instances/ProductType28
http://www4.wiwiss.fu-berlin.de/bizer/bsbm/v01/instances/ProductType97,"utilizers improvisational focalises","reallotting sulfating pastellist industrialist brayer secludedness tureens sullenly dissatisfied trifocals muonic preappearances superintend unrewarding purity intuitions daysides contractors smilaxes miscognizant wheelwrights obtrusions blithering qui ritzy basing righteousness procathedrals getters hickeys showgirls warmths",http://www4.wiwiss.fu-berlin.de/bizer/bsbm/v01/vocabulary/ProductType,http://www4.wiwiss.fu-berlin.de/bizer/bsbm/v01/instances/ProductType28
http://www4.wiwiss.fu-berlin.de/bizer/bsbm/v01/instances/ProductType98,"theaters quinces","fistic rereads archaizing exscinding semisatirically appendectomies amendatory siglos lignins scrabbled grunters harmoniousness servings tossers bountifulness arisings exampling residually unavoidableness toadflaxes aggravates indissolubly quizzer catamount",http://www4.wiwiss.fu-berlin.de/bizer/bsbm/v01/vocabulary/ProductType,http://www4.wiwiss.fu-berlin.de/bizer/bsbm/v01/instances/ProductType29
http://www4.wiwiss.fu-berlin.de/bizer/bsbm/v01/instances/ProductType99,"probed","corrupted executer scalars replanning unartfulness enfeoffing whoresons decrial bumming auf devein demurs babul underlined undemonstrably requestor keister oversold leafstalks obscurest noire whoso kindheartedly conjugators outgoing counteroffensives papuan",http://www4.wiwiss.fu-berlin.de/bizer/bsbm/v01/vocabulary/ProductType,http://www4.wiwiss.fu-berlin.de/bizer/bsbm/v01/instances/ProductType29
