subject,date,rev,reviewFor,rating1,reviewDate,rating2,rating3,rating4,publisher,22-rdf-syntax-ns,title
http://www4.wiwiss.fu-berlin.de/bizer/bsbm/v01/instances/dataFromRatingSite1/Review2,2007-11-18,http://www4.wiwiss.fu-berlin.de/bizer/bsbm/v01/instances/dataFromRatingSite1/Reviewer1,http://www4.wiwiss.fu-berlin.de/bizer/bsbm/v01/instances/dataFromProducer1/Product1,5,2007-09-04T00:00:00,2,,,http://www4.wiwiss.fu-berlin.de/bizer/bsbm/v01/instances/dataFromRatingSite1/RatingSite1,http://www4.wiwiss.fu-berlin.de/bizer/bsbm/v01/vocabulary/Review,gunnel hopes launchings deluder overemotional unfolder bioflavonoid,,,,,,,,,,,,,,,,,,,,,,,,,,,,,,,,,,,,,,,,,,,,,,,,,,,,,,,,,,,,,,,,,,,,,,,,,,,,,,,,,,,,,,,,,
http://www4.wiwiss.fu-berlin.de/bizer/bsbm/v01/instances/dataFromRatingSite1/Review3,2008-02-27,husbander ashram relativeness grannies rectangles unearthing conies capered toeshoe fervour domination impishly satirically photonegative kaleidoscopic morticians eyewaters rapturousness animater granting twier geosynclinal relearns cosmopolis maizes gemmy unmixt mumbler laundries selenography unpin findings mistrusts porgy discontentedly bolter hulkier windily whoremaster sovietizes expellees reordain fondness nightspots boggier microvasculature fellatee holders inebrious upping mucking yugoslavs blondness appal premenstrually fiddled disfavors sketchers inhumanities tightest unsatisfied cherubically stonefly mentally buddhists atelier eighteens smartly retaliates marbleizing trappings,http://www4.wiwiss.fu-berlin.de/bizer/bsbm/v01/instances/dataFromProducer1/Product1,3,2007-12-16T00:00:00,3,,,http://www4.wiwiss.fu-berlin.de/bizer/bsbm/v01/instances/dataFromRatingSite1/RatingSite1,http://www4.wiwiss.fu-berlin.de/bizer/bsbm/v01/vocabulary/Review,hyperbolas knouted eulogists bihourly prosiest matrixes jaggedest violinists dins archipelagos heighths limber azons acceptee,,,,,,,,,,,,,,,,,,,,,,,,,,,,,,,,,,,,,,,,,,,,,,,,,,,,,,,,,,,,,,,,,,,,,,,,,,,,,,,,,,,,,,,,,
http://www4.wiwiss.fu-berlin.de/bizer/bsbm/v01/instances/dataFromRatingSite1/Review4,2008-06-10,http://www4.wiwiss.fu-berlin.de/bizer/bsbm/v01/instances/dataFromRatingSite1/Reviewer1,http://www4.wiwiss.fu-berlin.de/bizer/bsbm/v01/instances/dataFromProducer1/Product1,,2007-12-16T00:00:00,,,,http://www4.wiwiss.fu-berlin.de/bizer/bsbm/v01/instances/dataFromRatingSite1/RatingSite1,http://www4.wiwiss.fu-berlin.de/bizer/bsbm/v01/vocabulary/Review,egomaniacal undercook roadstead reascend dekaliter grinning retakers paintbrushes cichlid ashlars conventual smoothen gombos appurtenance botchy,,,,,,,,,,,,,,,,,,,,,,,,,,,,,,,,,,,,,,,,,,,,,,,,,,,,,,,,,,,,,,,,,,,,,,,,,,,,,,,,,,,,,,,,,
http://www4.wiwiss.fu-berlin.de/bizer/bsbm/v01/instances/dataFromRatingSite1/Review5,2008-01-25,foretime managers updatable unzip bayonets bruins abstemiousness advocates destitutely increasing workaholics situating repartees mobilizers anorak magdalen inattentiveness filmstrips gusting runways tressiest obeyable lapps mooch defamatory whirs stealer pyramided motivates lapidates syllables showily orientates unhat smelting efficiencies calumniation adolescents loyalest steamboats excitability platy americanist photomicrograph wantonness parabolas massacring heatless episodes hopsack currying kb miscalled unweakened binned compactest pansophies palomino enureses ternate plottage brightly alkalinization underclerk fishmeal moulter valse kaleyards thaws hedonisms veiled tapes recension concusses enlargements mislabel requiems epitomizes clipsheets quixotries uplinking handsprings flexors concurrences snarls postulator involutions cortically upshifts dinette footfalls untaxed personification subdirectors fleabanes greases paradoxical discusses nondiscriminating heaped aroused machining broccolis synergist toppled techie scarlets scattiest magnetometer wiling pretensions impenetrableness argils feedbox halvahs sachems snobbiest impetigos hawknose zulus inadequately potbellied fetters sensuality revalidate elflock bucketful egoisms welterweight friendship topsoiling securer reevaluated proclaimer murker awaiting ferried quinone dengue toxoids unacceptance antibody reinflamed rehardens steeper aerifies unum overbalanced disciplined vulnerably achromat gustative celebrants nonfreezing kindnesses fresher analogs viviparous cosets poleward sagest impellers enjoyed tailpipes raying prevued flickering inshrining subscript resubmit grandstander pellagras cunts paleographer obsessiveness windlasses songfest inartistically epergnes guarani sonarman hassocks yardages alterability tetralogy treaded elevators anathematize surveyed evolvements juicier suffered commonweals wallpapering ionicity inaptness refreezes pepsine shammes reappraises,http://www4.wiwiss.fu-berlin.de/bizer/bsbm/v01/instances/dataFromProducer1/Product1,9,2007-09-02T00:00:00,,8,,http://www4.wiwiss.fu-berlin.de/bizer/bsbm/v01/instances/dataFromRatingSite1/RatingSite1,http://www4.wiwiss.fu-berlin.de/bizer/bsbm/v01/vocabulary/Review,disinformation muffled granulator basketries warthogs childbeds empowers pantomimist riverbanks loosens,,,,,,,,,,,,,,,,,,,,,,,,,,,,,,,,,,,,,,,,,,,,,,,,,,,,,,,,,,,,,,,,,,,,,,,,,,,,,,,,,,,,,,,,,
http://www4.wiwiss.fu-berlin.de/bizer/bsbm/v01/instances/dataFromRatingSite1/Review6,2008-02-21,archness occulter overdramatizes liverishness dandles boosting embalms restamp chaining strugglers skullduggeries hums manger pomades alternately pressurized gamed materfamilias supervenes darkest finer seels triste pronators giddiest tensing frauds vapouring sucroses emulsifiable cesarian octagons stoically suppurative catarrhs triadisms foreseen wennier scurviest focuser recrowned cropped signatures plotting asks disembarkations rickettsiae clubmen reinduction chilblains intertribal balsamic exotism reintroduced charade cubage oarless humanoids observingly mudcaps ubiquities decapitating digged glockenspiels hearted sapid weeny colliers cylindrical treeing ferries proselyte victorians signifies limeades iterances expressionist sculked supplanter commitment indemnifying sudoral calcifying captivator versified prating pithier daily,http://www4.wiwiss.fu-berlin.de/bizer/bsbm/v01/instances/dataFromProducer1/Product1,3,2008-01-01T00:00:00,,,5,http://www4.wiwiss.fu-berlin.de/bizer/bsbm/v01/instances/dataFromRatingSite1/RatingSite1,http://www4.wiwiss.fu-berlin.de/bizer/bsbm/v01/vocabulary/Review,squishiest ethicists bedraggling shivering crimsoned bondable,,,,,,,,,,,,,,,,,,,,,,,,,,,,,,,,,,,,,,,,,,,,,,,,,,,,,,,,,,,,,,,,,,,,,,,,,,,,,,,,,,,,,,,,,
http://www4.wiwiss.fu-berlin.de/bizer/bsbm/v01/instances/dataFromRatingSite1/Review7,2008-02-03,blueings tiresomely outdistanced gothicize ejectable materiels homogeneously paintiest sneezers workboat interphone ascii unconnected instrumentalist topographical disgruntling pederast sceptring racier evens trimeter banes misdemeanor webless rehinge mitigative defamers naturalist accustoms reclean valiancies pilled bearcats tents demultiplexes skulking publicized typecase supervisors escapeway recoinage blinding execs conformism treasures durums rondelle drawing oppressing bores coplots monogamousness zoospores unlikelihood preengaged overhands limekiln penetrator ultrasound lymphocytic radiolucencies chefs feoffment conventionalism cascading machos abundantly godchild frequented misplacing repairers surfy antedating chunter cancelers photoflash mistaught testacies solidest incarnation arrayers gruelingly honorands slobs builders preadjusting cpl fosterage trulls fakers toepiece maximally bouldery hampshirites dermatologies flopover noctambulation frizzler submissively reconsolidate clapping enunciators championed nigglingly tongers liquoring reminder podiatrists tussocks reprice renovating chevrolets refolds fantastical polarity ennuis franchisers undiluted macaroons,http://www4.wiwiss.fu-berlin.de/bizer/bsbm/v01/instances/dataFromProducer1/Product1,3,2007-08-15T00:00:00,4,,1,http://www4.wiwiss.fu-berlin.de/bizer/bsbm/v01/instances/dataFromRatingSite1/RatingSite1,http://www4.wiwiss.fu-berlin.de/bizer/bsbm/v01/vocabulary/Review,nearsightedly buskin recompensable capacitances bootee lockets enticement disservices strategists licensors kennelled barding autocrats lathworks,,,,,,,,,,,,,,,,,,,,,,,,,,,,,,,,,,,,,,,,,,,,,,,,,,,,,,,,,,,,,,,,,,,,,,,,,,,,,,,,,,,,,,,,,
http://www4.wiwiss.fu-berlin.de/bizer/bsbm/v01/instances/dataFromRatingSite1/Review8,2008-02-29,http://www4.wiwiss.fu-berlin.de/bizer/bsbm/v01/instances/dataFromRatingSite1/Reviewer1,http://www4.wiwiss.fu-berlin.de/bizer/bsbm/v01/instances/dataFromProducer1/Product1,4,2007-07-11T00:00:00,,,3,http://www4.wiwiss.fu-berlin.de/bizer/bsbm/v01/instances/dataFromRatingSite1/RatingSite1,http://www4.wiwiss.fu-berlin.de/bizer/bsbm/v01/vocabulary/Review,overexcited habitability reaching ethers gratias biers wretchedly warps poetess forthrightness kinaesthetically lukewarmly decorators viselike ionized,,,,,,,,,,,,,,,,,,,,,,,,,,,,,,,,,,,,,,,,,,,,,,,,,,,,,,,,,,,,,,,,,,,,,,,,,,,,,,,,,,,,,,,,,
http://www4.wiwiss.fu-berlin.de/bizer/bsbm/v01/instances/dataFromRatingSite1/Review9,2008-03-21,sharks bannock resuscitative motets gruels choosier apologizes anticyclonic equalities struggled crappiness reuniter immixes ozonizes quashes unlivable backslider feminizing bretons overhauling streaky forejudge weepers dourness viceless hies tubercular refurnish taggers inquisitional rebecs mouthwash deaconing metastasis weans adjectivally troths apperceptive nonprotectively beckoning commiseration guttersnipes doctoring gymkhana sheepmen apologizers ortolan toadyish quatrains revalue straying restacks frivolously pierced fauces babus novelistic gills regresses fossilization lipless sulphurize ohmage procrastinator alienator travelled rivets thrivers pingrasses steps campier mismarks plushier proteinaceous bunco snoozes glitters finical simulants hippies skims engrave soundtracks huffish nonnegotiable eclectically hatsful shaftings disobeyers identifies wingspread exceptionally replan aiming bedstraws tragically pollutants prefabricating isolation sextets rewarders approvement productive salaamed minatory ruleless microsurgeons circumambulate sapphisms nonsexually adjoined noticing deescalated habiting touristy unequalled lucidities discords matureness hydrocephaloid certifies undyingly doylies spellbinds prenatally govt unpolarized togae overjoying shirts reediness ecclesiastics awakens arrowing corncake crumbliness recommits viperish monkery unappetizingly quarrier speaks malthus overlook fatted archaists refreshed gayness filaree cirque vibrations leukemoid enquirer drossier prescience housewifeliness timed contentiousness constricting scramblers shivarees foilable dreidl tinfuls foolhardier downloading stuccos interpersonal doggish mislabel lowered solubility beguiler,http://www4.wiwiss.fu-berlin.de/bizer/bsbm/v01/instances/dataFromProducer1/Product1,7,2007-11-19T00:00:00,2,4,,http://www4.wiwiss.fu-berlin.de/bizer/bsbm/v01/instances/dataFromRatingSite1/RatingSite1,http://www4.wiwiss.fu-berlin.de/bizer/bsbm/v01/vocabulary/Review,buggered dewclaw loners hydrozoon zinging reequips saddlebags exorcises laudability topside novelle chemoreceptor temporized bloodstreams housemaids,,,,,,,,,,,,,,,,,,,,,,,,,,,,,,,,,,,,,,,,,,,,,,,,,,,,,,,,,,,,,,,,,,,,,,,,,,,,,,,,,,,,,,,,,
